{"schema":"kenshou.scenario-list/v1","suiteVersion":"0.1.0.0","scenarios":[{"id":"selftest/kernel/correctness/always-pass","layer":"selftest","component":"kernel","kind":"correctness","name":"always-pass","revision":1,"summary":"Always reports passed.","tier":"smoke","placement":"either","knownDefect":null}],"roles":[{"name":"selftest/echo","summary":"Echoes custom worker messages."}]}
